,text,review_cleaned_lemmatized,rating
28626,"The only problem that I had is that it should have been included with the Kindle Paperwhite. There is no way to charge the Paperwhite unless you buy the charger. The charging port on the Paperwhite is so small that nothing that I already have will work. Kindle does not even provide a USB cable so that you can charge from your computer. The outlet plug is cheep plastic (hollow) and will probably break, no warranty.",problem include kindle paperwhite way charge paperwhite unless buy charger charge port paperwhite small nothing already work kindle even provide usb cable charge computer outlet plug cheep plastic hollow probably break warranty,2.0
4574,"So I've been wanting a fire since they originally came out read some questionable review's about kindle basic stuff nothing seemed to really discourage me you really don't know what your experience will be unless you try so I got it and began the prime ""free trial "" I was shocked to wake up this morning to find out I had been charged $107.00 for a full year of prime one day before my trial was supposed to end no email no contact no are you interested they just charged my card without warning imaginably upset with Amazon. the tablet it self is so so and is slightly basic the front facing camera is slightly better then the outwards one the Alexa feature is kinda nice and fun to talk to it also sync's to other echo devices as well if buying for a teenager or any young adult do set parental controls and or passwords to keep from unauthorized perchues I think the tablet is OK but no great but because of my recent experience I rated it it 2 stars your ultimately going to make up your own mind and decided if your going to purchase this device and decide if its right for you good luck in your decision",ive want fire since originally come read questionable review kindle basic stuff nothing seem really discourage really dont know experience unless try get begin prime free trial shock wake morning find charge 10700 full year prime one day trial suppose end email contact interested charge card without warn imaginably upset amazon tablet self slightly basic front face camera slightly well outwards one alexa feature kinda nice fun talk also syncs echo device well buying teenager young adult set parental control password keep unauthorized perchues think tablet ok great recent experience rat 2 star ultimately go make mind decide go purchase device decide right good luck decision,2.0
13539,"It is tough to use these tablets if you are use to Apple products. Internal memory is minimal and is taken up by all of the Amazon programs it is running. Everytime my kids play a game, the wireless connection shuts down due to running out of memory. I would not recommend these tablets for anything more that an e-book reader.",tough use tablet use apple product internal memory minimal take amazon program run everytime kid play game wireless connection shuts due run memory would recommend tablet anything ebook reader,2.0
14331,Ok tablet...decent size screen & graphics. Was hoping I could mirror my phone to it but it doesn't have miracast.,ok tabletdecent size screen graphic hop could mirror phone doesnt miracast,2.0
14404,just bought it and not really happy i really expected more from amazon,bought really happy really expect amazon,2.0
13722,Purchased for my kids but it was hard to navigate and ended up with purchasing an iPad,purchase kid hard navigate end purchasing ipad,2.0
26693,"So sorry I bought this, had to change its wake up name to echo from Alexa it wouldn't answer to Alexa, on a scale of 1-10 with 1 being terrible I'll rate it a 2 most of the time didn't know how to answer or didn't understand the question, did all the self help and with amazon customer service am ready to return it",sorry bought change wake name echo alexa wouldnt answer alexa scale 110 1 terrible ill rate 2 time didnt know answer didnt understand question self help amazon customer service ready return,2.0
8212,I purchased this for my mother in law. She is getting old and wanted something she could see.The font size was never quite right for her and she was often confused by all the attempts this device makes to sell you something. It really wasn't a good fit for her.The device died approximately 1 week after purchase. We returned it for a refund.,purchase mother law get old want something could seethe font size never quite right often confuse attempt device make sell something really wasnt good fit herthe device die approximately 1 week purchase return refund,2.0
15739,I purchased this tablet a week ago as a gift for my brother and it has restarted itself over ten times and has shut off while someone was on in on different occasions Will be getting my money back and getting a samsung..,purchase tablet week ago gift brother restart ten time shut someone different occasion get money back get samsung,2.0
9736,Could not get this to work with my chromecast so I returned it.,could get work chromecast return,2.0
21846,"I bought this to use only one application. Oh, is it most difficult to get this thing to continuously work! And I still can't get the geek squad program to properly download onto the device. I'm pretty disappointed.",bought use one application oh difficult get thing continuously work still cant get geek squad program properly download onto device im pretty disappointed,2.0
5105,Very nice size. Now only 50$. There's no Google play store so can't use Google Chrome cast to watch movies on tv. A tablet Without a Google play store is a disadvantage.,nice size 50 there google play store cant use google chrome cast watch movie tv tablet without google play store disadvantage,2.0
7688,"I bought the tablet for games and surfing the internet. This is a slow tablet, not made for gaming - graphics are commonly not supported. Super cheap tablet, you get what you pay for. Ended up returning it.",bought tablet game surf internet slow tablet make game graphic commonly support super cheap tablet get pay end return,2.0
14329,"I didn't expect a lot at this price, but I also did not expect both of my tablets to be riddled with dead/stuck pixels right out of the box. I have a third arriving in the mail and am just praying that I am at least good for 1/3. Waiting on its arrival before doing the trip for return/replacement just in case that one needs to go as well. Maybe just bad luck, but definitely worth noting for anyone who may also be inconvenienced by having to do a return.Everything else seems good though when you can look past the display issues, but may be worth waiting until these defective lots have been disbursed and the issues have been corrected.I am sure if you don't have these display issues that the product deserves more than 2 stars, but if you can see things from my perspective it is kind of difficult to recommend this to anyone for the time being. If the display did not have these pixel issues I could see this easily being a 4 Star recommendation. If you do a little research you will see that there are definitely some lot numbers that are more problematic than others, so this is not just a rare incident. If it is for you and you plan to grab one from a brick and mortar location, do yourself a favor and just boot it up before you drive home. :)",didnt expect lot price also expect tablet riddle deadstuck pixel right box third arrive mail pray least good 13 wait arrival trip returnreplacement case one need go well maybe bad luck definitely worth note anyone may also inconvenienced returneverything else seem good though look past display issue may worth wait defective lot disburse issue correctedi sure dont display issue product deserves 2 star see thing perspective kind difficult recommend anyone time display pixel issue could see easily 4 star recommendation little research see definitely lot number problematic others rare incident plan grab one brick mortar location favor boot drive home,2.0
10473,This table is okay for me. But it is great for kids,table okay great kid,2.0
11163,"Compared to an equally inexpensive RCA tablet, this one has more limitations in the apps you can get. I was disappointed in its utility and prefer the RCA tablet over this one.",compare equally inexpensive rca tablet one limitation apps get disappointed utility prefer rca tablet one,2.0
14447,I got this to replace the iPad for a child. I am so disappointed by the charge. It dies so quickly and the charger has to be wrapped around the tablet in order for it to charge. This was after 2 weeks of having the tablet. Low price but not worth the hassle and disappointment!,get replace ipad child disappointed charge dy quickly charger wrap around tablet order charge 2 week tablet low price worth hassle disappointment,2.0
11459,"The processor is very slow. The tablet is great for reading books and ordering stuff from Amazon, but it is really slow opening aps. Pay more to get the better processor.",processor slow tablet great reading book order stuff amazon really slow opening aps pay get well processor,2.0
26573,I returned this to the store cuz I realised I didn't need music or lighting control. I replaced it with the echo dot. Disappointed because didn't know I needed wifi which I don't have.,return store cuz realise didnt need music light control replace echo dot disappointed didnt know need wifi dont,2.0
898,"If you need a basic tablet then the fire works. It falls apart when compared to the iPad mini from a usability, functionality and available apps standpoint.",need basic tablet fire work fall apart compare ipad mini usability functionality available apps standpoint,2.0
19366,"The earlier models were so simple to use. No nonsense listing of books in it's library, by author or title. Now there are big pictures with tiny lettering and lots of ads.",earlier model simple use nonsense listing book library author title big picture tiny letter lot ad,2.0
7806,"Very slow, freezes frequently but it was 34 dollars",slow freeze frequently 34 dollar,2.0
14988,"Bought this for my toddler to watch his shows on netflix amazon and vudu. Vudu isnt compatable, netflix is so slow it kept buffering, so he got upset. Acording to its specs it has a faster processing system than my linsay tablet bit its five times slower atleast. Downloading anything takes forever. It was also very difficult to navigate.Over all waste of money",bought toddler watch show netflix amazon vudu vudu isnt compatable netflix slow kept buffering get upset acording spec faster processing system linsay tablet bit five time slow atleast download anything take forever also difficult navigateover waste money,2.0
16542,When i purchased 2 if them i assumwd it would be kid friendly. Its fill with tons of bloat wear. The opening screen has about 15 -20 apps. It worse than a normal adult tablet. my kids dont use it at all because we have to unlock it for them everytime then open the kids app. Then we have to hover over them to help them ever step of the way.,purchase 2 assumwd would kid friendly fill ton bloat wear opening screen 15 20 apps bad normal adult tablet kid dont use unlock everytime open kid app hover help ever step way,2.0
4849,"The price was good, and while it worked, the tablet was decent, but about a week later the screen began to turn all white. I performed a factory reset, as the screen was barely visible but that did nothing. Heard it was a common problem with these. Won't be buying again, but if the issues are fixed in other models I would look at those.",price good work tablet decent week later screen begin turn white perform factory reset screen barely visible nothing heard common problem wont buying issue fix model would look,2.0
31252,Easy set up but did not meet my needs of being able to access Spectrum app. .,easy set meet need able access spectrum app,2.0
3415,"This charger FRIED my Kindle Fire, Samsung Galaxy S6, and Samsung Galaxy J7. DO NOT plug your other devices up to it!!! It easily comes detached from the Fire tablet but does charge it. I'm just very unhappy that it killed my other devices. There are young children in my home and they know the difference between Apple and Android charging tips. So they will use any available charging cable they find when needed.",charger fry kindle fire samsung galaxy s6 samsung galaxy j7 plug device easily come detach fire tablet charge im unhappy kill device young child home know difference apple android charge tip use available charge cable find need,2.0
29262,"For the price, you should be able to use as a speaker when talking on the phone. I had to use my daughter's Beats Pill for this function, therefore it's not worth all the hype.",price able use speaker talk phone use daughter beat pill function therefore worth hype,2.0
2200,"I loved this tablet. I did! BUT I did not love that I was being sold ads every time I powered up! I loathe even more that I would have had to pay $15 to discontinue that feature. Amazon if you want $105 dollars for the Kindle Fire, charge it! but don't under price the device, and then flash ads at the the consumer at every opportunity. It is unbecoming of you! I returned this item pronto!",love tablet love sell ad every time power loathe even would pay 15 discontinue feature amazon want 105 dollar kindle fire charge dont price device flash ad consumer every opportunity unbecoming return item pronto,2.0
28869,"I love the kindle and have had one in one shape or another since they first came out, but I just could not take how slow this model was. I returned it and purchased a Samsung tablet.",love kindle one one shape another since first come could take slow model return purchase samsung tablet,2.0
6365,"I wanted a small tablet to read news and watch videos. I have Amazon Prime, so I figured why not, it is really cheap. Well, I believe you get what you pay for. This fire tablet froze on me, when I only had one thing open. I am very disappointed. It also is very slow when you rotate the screen. Ugh! I will be returning it.",want small tablet read news watch video amazon prime figure really cheap well believe get pay fire tablet froze one thing open disappointed also slow rotate screen ugh return,2.0
14414,the tablet is certainly a good value but the wifi signal drops frequently and even when it shows its connected can fail to download any data. Perhaps this is a glitch that will be fixed in a later SW update but for now I have to say the performance is underwhelming. the Backlight also has some serious bleed issues which is a sign of an inferior design and or workmanship. The fire 7 HD which i also own has none of these issues. Get what you pay for rings true again.,tablet certainly good value wifi signal drop frequently even show connect fail download data perhaps glitch fix later sw update say performance underwhelming backlight also serious bleed issue sign inferior design workmanship fire 7 hd also none issue get pay ring true,2.0
6677,"Once connected to my wi-fi, it would not connect to daughters wi-fi when I visited her. The loading time for programs is really slow. Oh well, what did I expect for only $49??",connect wifi would connect daughter wifi visit load time program really slow oh well expect 49,2.0
18292,Very nice eReader - a big step up from the basic reader that I started with.,nice ereader big step basic reader start,2.0
34387,"It's somewhat of a step up from the Roku 3 I was previously using, but not as much as I was expecting. I think it's a couple firmware updates away from being better than it is now.Spent the good part of the day trying to figure out why I could only connect to my dual-band router at 2.4GHz and not 5GHz. 1.5 hours on the phone with Verizon FiOS tech support was unsuccessful as other devices connected at 5GHz without issue. Was about to pack it up and return it until I called Amazon tech support. Turns out it's a known-issue that the FireTV has difficulty with 5GHz networks that are set to auto channel selection and are utilizing channel numbers above 100.The tech support person said I should change the channel to 36, 44, or 48 instead of automatic, and, it worked.Bluetooth audio and video are out of sync with Showtime, Netflix, Sling, Plex and Hulu. It's fine through speakers, but video lags slightly behind the audio using Bluetooth. Audio and video are in perfect sync with Bluetooth and Amazon Prime Video which makes me think it'll be fixed at some point, as Amazon provided video demonstrates it can work well in that regard.Gotta say I prefer the platform agnostic UI of Roku, with Amazon-world tucked away in an app. The FireTV navigation pane represents mostly Amazon products with no option to modify it. Roku's UI is more about the media, less about the provider. Voice search works well if you want only to be presented with Amazon's viewing options, for some reason I thought search was universal, but only movies and TV shows available through Amazon show up. Bummer :-(The FireTV-2 is OK, less than I was expecting and with other good options around the corner, I'm beginning to doubt my choice...",somewhat step roku 3 previously use much expect think couple firmware update away well nowspent good part day try figure could connect dualband router 24ghz 5ghz 15 hour phone verizon fios tech support unsuccessful device connect 5ghz without issue pack return call amazon tech support turn knownissue firetv difficulty 5ghz network set auto channel selection utilize channel number 100the tech support person say change channel 36 44 48 instead automatic workedbluetooth audio video sync showtime netflix sling plex hulu fine speaker video lag slightly behind audio use bluetooth audio video perfect sync bluetooth amazon prime video make think itll fix point amazon provide video demonstrates work well regardgotta say prefer platform agnostic ui roku amazonworld tucked away app firetv navigation pane represent mostly amazon product option modify rokus ui medium less provider voice search work well want present amazon view option reason thought search universal movie tv show available amazon show bummer firetv2 ok less expect good option around corner im begin doubt choice,2.0
11325,I bought 3 of them as gifts for my nephews. It was really disapproval to learn that they were already linked to my Amazon account. I started getting notices everything's they downloaded something. I had to literally unlink everyone one of them from my account before they made a big purchase (which they did purchase Amazon Prime-which I cancelled because I wasn't ready for a $100 purchase).,bought 3 gift nephew really disapproval learn already link amazon account start get notice everythings download something literally unlink everyone one account make big purchase purchase amazon primewhich cancel wasnt ready 100 purchase,2.0
28818,"I had originally decided to get a kindle instead of an iPad due to the cost. It's a great screen and has good sound, but the battery is pure junk! I should have went with an iPad.",originally decide get kindle instead ipad due cost great screen good sound battery pure junk go ipad,2.0
444,"If you shop on Amazon all the time, this will help make it easier still. Lots of ads pop up, and you can't use apps from non-Amazon sources unless you root it, and that is complicated. This is not a realistic alternative to an iPad or Galaxy Note. If you just want to a device to shop on Amazon with, you'll love it.",shop amazon time help make easy still lot ad pop cant use apps nonamazon source unless root complicate realistic alternative ipad galaxy note want device shop amazon youll love,2.0
4312,apps constantly fail to open. no flash for camera. hard to download anything not amazon ie: google apps. will be returning....,apps constantly fail open flash camera hard download anything amazon ie google apps return,2.0
18209,"I wanted to like this a lot because my Ipad Mini is ""heavy"" to carry in my purse all the time. This is so very light. BUT they make you jump through hoops to get rid of all the advertising on the device AND when you buy it at Best Buy you are not given a choice to ""spend an extra 20 on a 119 dollar ""book"" or put up with their ads"". I had to go through being on hold FOREVER to get someone to help get this off my device so that was an IMMEDIATE turn-off. I don't find it to page-turn handle as well as my OLD ORIGINAL NOOK OR NOOK COLOR and certainly not anything like the Ipad Mini. If I hadnt kept it too long to return I would have. It doesn't auto correct to landscape then portrate, nope you have to MANUALLY CHOOSE ONE OR THE OTHER AND GOING BACK AND FORTH IS just stupid...it should have been part of the IMPROVED design, THEY REALLY MISSED THE MARK FOR THE PRICE. i CAN GET A FULL TABLET FOR LESS MONEY THAT DOES ALL THAT AND SIMPLY USE THE KINDLE APPPROSLight weightSmall for purseback lightCONS1-comes preloaded with ads2-not easy to get them off if you buy device in a store3-page control is not that simple4-t doesn't auto turn from landscape to portrate you have to set it to one OR the other5-not as touch responsive to anything6-don't like the organization of it",want like lot ipad mini heavy carry purse time light make jump hoop get rid advertising device buy best buy give choice spend extra 20 119 dollar book put ad go hold forever get someone help get device immediate turnoff dont find pageturn handle well old original nook nook color certainly anything like ipad mini hadnt kept long return would doesnt auto correct landscape portrate nope manually choose one go back forth stupidit part improve design really miss mark price get full tablet less money simply use kindle appproslight weightsmall purseback lightcons1comes preloaded ads2not easy get buy device store3page control simple4t doesnt auto turn landscape portrate set one other5not touch responsive anything6dont like organization,2.0
16953,I didn't find it useful for my 4yr old daugter so i returned it the other day.All the games in it r so kiddy games.,didnt find useful 4yr old daugter return dayall game r kiddy game,2.0
17572,"Reading a book, it's great. Working with PDF files, not so great. Also please be aware that Amazon Customer Service will treat you like a pariah because you purchased this Kindle from Best Buy instead of directly through their store.",reading book great work pdf file great also please aware amazon customer service treat like pariah purchase kindle best buy instead directly store,2.0
13740,"I bought this on Black Friday, simply because it was dirt cheap. It works ok but kinda slow.",bought black friday simply dirt cheap work ok kinda slow,2.0
11396,"It all depends on what your using a 50 dollar tablet to do is it for extreme gaming then i highly do not recommend this device. It is better for light use on the safe side use for 5h a day. 8h a day battery is the average, but runs down faster and over heats when playing a 3D game. But if u are on tight budget it is useful. ANOTHER MAJOR PROBLEM is that almost all apps that you would get on iphone and android are not availabe on the amazon fire appstore and there is no way to download them, for example clash of clans, racing rivals( which have decided to withdraw from the amazon contract and delte there game off amazons app stores). And other bigger titles omg even snapchat is not on there.",depends use 50 dollar tablet extreme game highly recommend device well light use safe side use 5h day 8h day battery average run faster heat play 3d game u tight budget useful another major problem almost apps would get iphone android availabe amazon fire appstore way download example clash clan race rival decide withdraw amazon contract delte game amazon app store big title omg even snapchat,2.0
29426,"I'm thinking this must of been a fluke, it never worked. Had to return item but received full refund",im think must fluke never work return item receive full refund,2.0
23161,Doesn't answer as many questions as led to believe should have google instead of Bing a simple alarm clock is all I use it for not much good for anything else would have returned it but I like gadgets . Don't recommend purchasing,doesnt answer many question lead believe google instead bing simple alarm clock use much good anything else would return like gadget dont recommend purchasing,2.0
14183,"Pros:InexpensiveExpandable storageGood for Amazon Prime members and Amazon shoppersCons:Slow/sluggish performanceLack of apps (no YouTube, Instagram etc)Some available apps crash or can not be installedTouch screen freezesScreen resolution is not sharp or bright, greenish hueToo many links/ads to buy thingsSound quality is not goodWiFi onlyConclusion:For the price the Amazon Fire 7 Tablet is good for those who want an eReader that can also access email, Facebook and Amazon Prime but the lack of apps, cheap construction and buggy performance keep it from being a good, full-featured tablet.",prosinexpensiveexpandable storagegood amazon prime member amazon shoppersconsslowsluggish performancelack apps youtube instagram etcsome available apps crash installedtouch screen freezesscreen resolution sharp bright greenish huetoo many linksads buy thingssound quality goodwifi onlyconclusionfor price amazon fire 7 tablet good want ereader also access email facebook amazon prime lack apps cheap construction buggy performance keep good fullfeatured tablet,2.0
6355,Bought the tablets for my kids. The tablet isn't really friendly for them. The home pages try to take you to amazon stuff only and when they download games it's kind of hard to find them. Battery life can't hold up to a 5yr old. He runs it dead quicker then it can charge.,bought tablet kid tablet isnt really friendly home page try take amazon stuff download game kind hard find battery life cant hold 5yr old run dead quicker charge,2.0
