,text,review_cleaned_lemmatized,rating
21390,"Kindle Fire continues to be my fav device to keep in touch with family and friends...internet, Facebook, messenger, email, movies, books, music...does it all. I'm never bored!!",kindle fire continue fav device keep touch family friendsinternet facebook messenger email movie book musicdoes im never bore,4.0
152,"my opinion its a good option for the cost. Not as great as Apple Ipad, but it costs so much less. Still can get good use",opinion good option cost great apple ipad cost much less still get good use,4.0
12609,had to return a digiland tablet that I got for my daughter for Christmas and best buy didn't have another digiland so they let me get the kindlefire instead of the digiland. My daughter likes it all except for the fact that she can't get the google play games that I have on my tablet.,return digiland tablet get daughter christmas best buy didnt another digiland let get kindlefire instead digiland daughter like except fact cant get google play game tablet,4.0
770,"I love my kindle, I can listen to music,read my emails, or pick a book to read. Everything loads up easily.",love kindle listen musicread email pick book read everything load easily,4.0
6802,Purchased during Black Friday sale 2016 as an impulse buy. Great little tablet and great value!,purchase black friday sale 2016 impulse buy great little tablet great value,4.0
33800,Amazon updated their Fire TV box and this is a good option if you want a 4K upscale tv box.,amazon update fire tv box good option want 4k upscale tv box,4.0
10042,This is a nice tablet useful on the go and I love it,nice tablet useful go love,4.0
19861,"This has been really good, easy to read and easy to transport.",really good easy read easy transport,4.0
12599,When my kids play a game on their profile the system goes to the screensaver. My dad's doesn't do this so it may just be a software issue on mine. But altogether I do love having the Fire.,kid play game profile system go screensaver dad doesnt may software issue mine altogether love fire,4.0
8929,"Bought this for my son who is 3. He loves it. Compared to an iPad isn't not great, but for $50, it's pretty great.",bought son 3 love compare ipad isnt great 50 pretty great,4.0
19218,I have been enjoying my paperwhite. Like buying booKS and reading free books as an amazon prime membership benefit. I also bout a book that was in pdf format an I was able to read on paperwhite also,enjoy paperwhite like buying book reading free book amazon prime membership benefit also bout book pdf format able read paperwhite also,4.0
15427,I bought this to read books on. Excellent for that. Difficult to navigate otherwise,bought read book excellent difficult navigate otherwise,4.0
5538,Great beginner tablet. Used for my kid to view videos.,great beginner tablet use kid view video,4.0
26173,"Love Alexa especially if your are a Amazon geek. She does what she is told. lol Ordering finding music, help in kitchen. Find an answer to almost anything!",love alexa especially amazon geek told lol order find music help kitchen find answer almost anything,4.0
29887,I think it's a awesome device if you like tok stream.,think awesome device like tok stream,4.0
5090,I used it as a gift in an office holiday secret Santa,use gift office holiday secret santa,4.0
254,"This is the best device I have found for my e-books. I know it can be used for a lot more, but it is my library in my hand.",best device found ebooks know use lot library hand,4.0
15540,Too many advertising and too many pages to sort through.,many advertising many page sort,4.0
30550,Love this product and LOVE Amazon! It replaced my old Fire TV.,love product love amazon replace old fire tv,4.0
26768,I got this item for a great price..I order it in the Best Buy web site and was ready to pick up in 45 min. Great customer service,get item great pricei order best buy web site ready pick 45 min great customer service,4.0
5477,I will enjoy it even more once I have the apps I want downloaded. This Kindle Fire will be fun!,enjoy even apps want download kindle fire fun,4.0
13986,This is a great light weight android tablet. It works well for most things that I wanted to use it for. I wanted to see if it would work for board packets but decided that the form factor is too small. As a reader and light weight table it works great. At this price it is a great buy.,great light weight android tablet work well thing want use want see would work board packet decide form factor small reader light weight table work great price great buy,4.0
14106,Slow and has issues recognizing the sd card. I have enjoyed it however.,slow issue recognize sd card enjoy however,4.0
3639,"This Kindle is nice and my wife who is an avid reader likes the screen quality but truthfully does not like being ""pigeon-holed"" by Amazon for every book or story. Having to go through them for nearly everything greatly declines from the ease of use of the various functions. The need to find or put her existing library into Amazon in order to use it on the Kindle is ridiculous and annoying. Once again a another good product being sadly limited due to a monopoly.",kindle nice wife avid reader like screen quality truthfully like pigeonhole amazon every book story go nearly everything greatly decline ease use various function need find put exist library amazon order use kindle ridiculous annoy another good product sadly limited due monopoly,4.0
32327,The amazon worked fine and I am glad I purchased the item,amazon work fine glad purchase item,4.0
17671,"I read as many reviews as I could find before buying this newest Paperwhite and what struck me the most was the contrast of the bright screen versus the print. However, when I got mine, I had to put the brightness level to 19 (out of 25) to get it to a comfortable setting. Doing that makes my battery run down before I've even read two books, and that is with the airplane setting on, meaning the WIFI is off. Luckily, I bought a charger so I can charge my Paperwhite while on trips ( without my computer, in a regular outlet) or at night when I'm finished reading. Now for the positives. I love the light weight of this Kindle even with the preferred cover that shuts it into sleep mode when closed. I absolutely LOVE the dictionary feature, because it is so easy to use and it saves the words I don't know, for study. After I've learned a word's meaning, I can delete it from the list. I got the Paperwhite with the ads, because it is nice getting suggestions of books I might enjoy that I might not see otherwise. And books are easy to order from the Kindle Store and to download through this devise. I like the cover, because it protects the screen from scratches while stored in my purse and I also purchased a stylus to keep fingerprints off the screen and I like that. Generally, I am happy with this purchase.",read many review could find buying new paperwhite struck contrast bright screen versus print however get mine put brightness level 19 25 get comfortable set make battery run ive even read two book airplane set meaning wifi luckily bought charger charge paperwhite trip without computer regular outlet night im finish reading positive love light weight kindle even prefer cover shuts sleep mode close absolutely love dictionary feature easy use save word dont know study ive learn word meaning delete list get paperwhite ad nice get suggestion book might enjoy might see otherwise book easy order kindle store download devise like cover protects screen scratch store purse also purchase stylus keep fingerprint screen like generally happy purchase,4.0
313,Enjoy reading books on it as well as viewing videos.,enjoy reading book well view video,4.0
26415,"I like the echo, but too much to look up with the skills.",like echo much look skill,4.0
7223,My kid loves this tablet. not expensive and the battery lasts a long time.,kid love tablet expensive battery last long time,4.0
33871,"I was a little upset at first after purchase seeing that I pretty much need to be an Amazon prime member to get the full benefits of Amazon tv. On the other hand, It's way cheaper than having to pay a cable bill in the long run!",little upset first purchase see pretty much need amazon prime member get full benefit amazon tv hand way cheaper pay cable bill long run,4.0
12185,Super easy to use and small enough to carry in my purse,super easy use small enough carry purse,4.0
14169,"Would be better if you could use the Google play store, still haven t figured out how to download yet",would well could use google play store still figure download yet,4.0
1464,"Bought this during black Friday sale offer, was a good purchase and cheap.",bought black friday sale offer good purchase cheap,4.0
20009,"There is nothing else left on the eink market anyway but the Amazon Kindle. It still doesn't support epub format of course, Amazon doesn't like competition. It is built OK, moderately cheap plastic, but no squeaking at least. Contrast is OK, I had Nook and it is on par. I can't imagine how bad the regular Kindle would be though. This one with 300 dpi is just OK. Scrolling is fast enough, it has integrated vocabulary. No home menu or other physical buttons though, besides the home Kindle one - the UI is not completely responsive when you try to go to your Library, instead home brings you to Amazon Kindle page, where you are overwhelmed with advertisement.My biggest dislike is the volume of advertisement and thus the convoluted interface. It is WAY worse then Nook, which is much more reading-centric.A lot of cheap and free books are available on Amazon, especially with Prime membership. It can be linked to public library for ebooks as well.",nothing else left eink market anyway amazon kindle still doesnt support epub format course amazon doesnt like competition built ok moderately cheap plastic squeak least contrast ok nook par cant imagine bad regular kindle would though one 300 dpi ok scroll fast enough integrate vocabulary home menu physical button though besides home kindle one ui completely responsive try go library instead home brings amazon kindle page overwhelmed advertisementmy big dislike volume advertisement thus convolute interface way bad nook much readingcentrica lot cheap free book available amazon especially prime membership link public library ebooks well,4.0
13438,CHRISTMAS GIFT FOR MY GRAND KIDS AND NO COMPLANTES AS OF YET.,christmas gift grand kid complantes yet,4.0
20512,Wanted a easy reading for outdoors. Close this based on reviews. Did not need to replace my iPad with the more expensive Fire tablet. Would have given it a 5 star but amazon packages them with out a charger adapter.,want easy reading outdoors close base review need replace ipad expensive fire tablet would give 5 star amazon package charger adapter,4.0
18236,Love the lack of bells and whistles stuck in Airport battery lasts forever,love lack bell whistle stuck airport battery last forever,4.0
11365,I use my Kindle Fire mostly for reading Kindle books and I am pleased with this inexpensive little tablet.,use kindle fire mostly reading kindle book pleased inexpensive little tablet,4.0
22137,"Echo can do many things. It can play your songs, answer questions, serve as an alarm clock, etc. It listens constantly and responds immediately. When I forget a spelling, Echo can tell you how.",echo many thing play song answer question serve alarm clock etc listens constantly responds immediately forget spell echo tell,4.0
33676,"Works Great, Flixster is a little slow compared to vudu but at least I can still view my movies from vudu.",work great flixster little slow compare vudu least still view movie vudu,4.0
33620,We were already a prime member so no extra cost for service,already prime member extra cost service,4.0
4432,Very nice tablet for the price. Built in storage is limited but easily expandable with a microSD card. The Freetime app for kids is excellent. Overall I would recommend this tablet.,nice tablet price built storage limited easily expandable microsd card freetime app kid excellent overall would recommend tablet,4.0
15177,"I've purchased 5 of these for my kids the last few years. While they are playing a tablet or two, I keep the other tablets charged. I've enjoyed using them myself.",ive purchase 5 kid last year play tablet two keep tablet charge ive enjoy use,4.0
11695,Bought it for my nephew and he loves it;his old one was slow and the space for bigger apps was limited.Good parental controls.,bought nephew love ithis old one slow space big apps limitedgood parental control,4.0
14788,This is an upgrade for my wife as her old kindle wouldn't charge anymore. She likes the feel and the games plus reading material. It rolled over most of her games easily tried to get her to buy an iPad but she has all she needs on thus device,upgrade wife old kindle wouldnt charge anymore like feel game plus reading material roll game easily try get buy ipad need thus device,4.0
9830,The tablet and chrome cast is great for my child....,tablet chrome cast great child,4.0
12478,"Purchased for my niece as a gift. She's 2, so to watch her online videos, this is perfect!",purchase niece gift shes 2 watch online video perfect,4.0
28397,The only thing missing is SONOS integration. When Amazon managed to allow for echo to be conected to an speaker system such as SONOS this product will be deserving of a 10 star.It does what is mean to do flawless.,thing miss sonos integration amazon manage allow echo conected speaker system sonos product deserve 10 starit mean flawless,4.0
4124,I purchased this tablet when it was on sale for black Friday. Overall it works great. Can't beat the price.,purchase tablet sale black friday overall work great cant beat price,4.0
14616,"Bought this to install Kodi, Netflix and Hulu on. Definitely works as a multi source video device. It's slow but you can't beat what it can do for the money.",bought install kodi netflix hulu definitely work multi source video device slow cant beat money,4.0
579,Light to carry and good picture quality. This was purchased for a hearing impaired person to download video in American Sign Language . This product was easy to maneuver for someone that was not use to a tablet.,light carry good picture quality purchase hearing impaired person download video american sign language product easy maneuver someone use tablet,4.0
29540,I like the Amazon Tap. I use it as a speaker in my garage for working out. It is tied to my Amazon Echo. I am able to use Alexa and Amazon Prime material. Would highly recommend.,like amazon tap use speaker garage work tie amazon echo able use alexa amazon prime material would highly recommend,4.0
9766,"Pleased with this purchase. Good for surfing, reading, games,email. Wish I could use it in the sun to read.",pleased purchase good surf reading gamesemail wish could use sun read,4.0
26366,"Alexa sits in my home office and plays music for me throughout the day. She is also quite helpful when my children ask me questions that I don't have time to look up for them. Fun product, easy information gathering.",alexa sits home office play music throughout day also quite helpful child ask question dont time look fun product easy information gathering,4.0
28118,This was discounted on Best Buy better than Amazon. It is a great device and even better $50 off,discount best buy well amazon great device even well 50,4.0
23230,"Search engine could be better ,but fine for simple questions. Great for playing music.",search engine could well fine simple question great play music,4.0
23914,"okay for a toy, does not work well for some of us, with different noise environment, and different accent. Some times the searched results are funny. Also, hope it support other languages. Price too high also.",okay toy work well u different noise environment different accent time search result funny also hope support language price high also,4.0
12169,"I recently purchased this item for various reasons and so far it meets my expectations. However, I did have an issue with the voice volume on the video why flying for 5 hours.",recently purchase item various reason far meet expectation however issue voice volume video fly 5 hour,4.0
7743,Easy to use. Memory fills up fast though. Battery life is decent.,easy use memory fill fast though battery life decent,4.0
13851,It's a good tablet for a good price I also love the free trial of amazon prime,good tablet good price also love free trial amazon prime,4.0
32097,This version of it is harder to use. Prefer old one,version harder use prefer old one,4.0
34557,overall pretty good sometimes the device shut off you might need to contact amazon,overall pretty good sometimes device shut might need contact amazon,4.0
27930,Good for A lot of things. Listen to news briefs in the morning. Hooked up my lights to it. Great product,good lot thing listen news brief morning hooked light great product,4.0
6701,Its just enough for my 3 yr old. Enough storage space. Easy to navigate through.,enough 3 yr old enough storage space easy navigate,4.0
12364,"For a tablet, good price and functions. Was tired of working a lot on smart phone. This is a good substitute. Will even order books.",tablet good price function tire work lot smart phone good substitute even order book,4.0
3951,This is nice tablet with great functions. Great for reading books. Fairly easy to use on the web. Lots of Apps available.,nice tablet great function great reading book fairly easy use web lot apps available,4.0
14837,I bought this as a first time tablet for my mother. She has really learned to use it freely. The color and size are perfect for her. She uses it mainly to search the internet and check her emails. Great starter. I am going to download some books for her to read as she travels.,bought first time tablet mother really learn use freely color size perfect us mainly search internet check email great starter go download book read travel,4.0
21240,"My 3 yr old has already figured it all out. User friendly and durable with the case. Lots of free content, keeps them busy when need be.",3 yr old already figure user friendly durable case lot free content keep busy need,4.0
15922,Simple to use and setup for a 2 years old toddler.,simple use setup 2 year old toddler,4.0
15618,The features that I found on the Fire tablet far exceeded my expectations. Well worth the purchase price.,feature found fire tablet far exceed expectation well worth purchase price,4.0
611,"GREAT value for the cost - not as fast as a high end tablet, but certainly faster than I was expecting. Clear viewing and easy navigation",great value cost fast high end tablet certainly faster expect clear view easy navigation,4.0
20993,Bought this reader for a present for my mom. She loves it. Able to take her book with her in a smaller form loves how it looks like paper pages. Easy to order a new book.,bought reader present mom love able take book small form love look like paper page easy order new book,4.0
7889,i love diz one cheap&best price last year purchase this product,love diz one cheapbest price last year purchase product,4.0
33983,Plugged it directly into my router for a faster connection and it works great,plug directly router faster connection work great,4.0
22725,Our technology and innovation are great and this device is a great tool to make life easier.,technology innovation great device great tool make life easy,4.0
2278,"Paying $49 for a decent screen size to support portable surfing and email on wifi is a great deal. Not sure I'm a fan of Silk, but it works well enough.",pay 49 decent screen size support portable surf email wifi great deal sure im fan silk work well enough,4.0
28816,I love this device! Perfect size for my bad eyesight! Lol! I use it all the time! One down side is the .battery life is not great!,love device perfect size bad eyesight lol use time one side battery life great,4.0
23054,Having some problems with our Echo. Does not hold the internet connection. Other devices on the wifi are fine.,problem echo hold internet connection device wifi fine,4.0
32973,I have three amazon products this as well as a kindle and fire stick. This fire TV has the advantage because of the ethernet port. Offers Fox Go for the Yankees but still no TWC compatibility which is why it gets 4 stars out of 5.,three amazon product well kindle fire stick fire tv advantage ethernet port offer fox go yankee still twc compatibility get 4 star 5,4.0
14886,GOOD DEVICE AND CHIPPER THAT SAMSUNG OR APPLE DEVICES.,good device chipper samsung apple device,4.0
16929,Purchased for the grandkids to use while they are visiting. They never seem to get bored.Tip. Make sure you have it password protected or you may find a rapid run up in charges!,purchase grandkids use visit never seem get boredtip make sure password protect may find rapid run charge,4.0
28896,I go this tablet after problems with 2 Samsung tablets. so far like it. all apps I use available. A little slower than previous tablets that is the only reason for the 4 stars,go tablet problem 2 samsung tablet far like apps use available little slow previous tablet reason 4 star,4.0
24777,"Alexa looks great in my ciunter, she responds quickly ti my request. Im sure amazin will be adding more features innthe near future! At least i hope so",alexa look great ciunter responds quickly ti request im sure amazin add feature innthe near future least hope,4.0
5527,This is a nice small tablet. Works well and great with Amazon products. A great price.,nice small tablet work well great amazon product great price,4.0
14126,"This is a Christmas gift so we haven't been able to fully review it but it was very simple to set up, add apps and games. I really like the parental controls!",christmas gift havent able fully review simple set add apps game really like parental control,4.0
19452,"Bought for my wife for mothers day, as she wanted something to read in the sunshine this summer, and it performs amazingly in that respect. We have iPads and regular Kindle Fire units (the kids), but only this one can be read in any light, any time of day. Only 4 stars as I'm not sure why terribly more expensive than the Fire units, but it solves for those who like to read under sunlight at the beach or by the pool, couldn't be clearer.",bought wife mother day want something read sunshine summer performs amazingly respect ipads regular kindle fire unit kid one read light time day 4 star im sure terribly expensive fire unit solves like read sunlight beach pool couldnt clearer,4.0
2184,the fire hd is great for reading kindle books . Its pretty slow for surfing the web. If your looking for a great kindle this is it. I would not recommend this for surfing the web.,fire hd great reading kindle book pretty slow surf web look great kindle would recommend surf web,4.0
3929,Amazon has made a device that's very easy to use for a first time tablet user like myself.,amazon make device thats easy use first time tablet user like,4.0
14135,"Better than expected for the price. Sturdy enough for regular use, fast enough for streaming and fits nicely in the hands or on the lap.",well expect price sturdy enough regular use fast enough stream fit nicely hand lap,4.0
11601,"I think that for the price, this product is fantastic. It is more than acceptable for media consumption. I highly recommend it for those on a budget or need a secondary consumption device.",think price product fantastic acceptable medium consumption highly recommend budget need secondary consumption device,4.0
10097,"This is my third Kindle, quite easy to use, kid friendly",third kindle quite easy use kid friendly,4.0
22263,"This product is convenient for listening to music hands free, but not real user friendly. Alexa is not real knowledgeable and logic is at best that of a small child.",product convenient listen music hand free real user friendly alexa real knowledgeable logic best small child,4.0
11623,The many features make this an ideal tablet purchase.,many feature make ideal tablet purchase,4.0
20039,Great for reading! Light is perfect and does not hurt your eyes. If you are always on the go the Kindle is for you!,great reading light perfect hurt eye always go kindle,4.0
6409,"This is a great tablet, and the price was amazing!",great tablet price amaze,4.0
16880,"My Grandson can't put it down! With access to so many educational apps and games, you really can't lose.",grandson cant put access many educational apps game really cant lose,4.0
19389,I bought this for my friend and I also like its shutterfly coupon. It is wonderful.,bought friend also like shutterfly coupon wonderful,4.0
7910,This tablet is great for the young kids gift ideas.,tablet great young kid gift idea,4.0
30185,Works. You must have the unit hard wired to your network to get the unit to sync with your phone or tablet so they can be used as a remote.,work must unit hard wire network get unit sync phone tablet use remote,4.0
8529,Its good for going on the internet and doing minor things. Some of the pictures on the internet have been enlarged to look out of focus.,good go internet minor thing picture internet enlarge look focus,4.0
8496,"We were looking for an affordable, quality tablet - and this did the trick! We are Fire fans!",look affordable quality tablet trick fire fan,4.0
1130,"I bought this 8"" Amazon Fire HD for my Wife as a Christmas Present. Her old 7"" Amazon Fire that she had for about 3-4 Years. She is very happy with the 8"" Amazon Fire HD. Can't beat the price for a Tablet.",bought 8 amazon fire hd wife christmas present old 7 amazon fire 34 year happy 8 amazon fire hd cant beat price tablet,4.0
