,text,review_cleaned_lemmatized,rating
15931,"The reviews on this on Amazon seemed awesome. Little did I know that there is a chronic problem with the port on these tablets. We just bought this for Christmas and went to charge it for the first time. Nothing. We already loaded (and paid for) several apps, and now we're out that money. Also the charging cord that came with it appears it has been used before - there's some wear at the edge of it. So I went online to see if I could find this issue and there it is - everywhere. This is a problem that has been around for years, but Android - who is the ultimate culprit, has failed to fix it at the source. When you plug in the charger, there's no 'click' so you know it's in place. It just slides in and out. We've had Apple products for several years and never had an issue, then the first Droid product we purchase can't even be charged from the beginning. This will be going back to BestBuy - and will buy another iPad Mini - costs more, but is much much more reliable.",review amazon seem awesome little know chronic problem port tablet bought christmas go charge first time nothing already load paid several apps money also charge cord come appear use there wear edge go online see could find issue everywhere problem around year android ultimate culprit fail fix source plug charger there click know place slide weve apple product several year never issue first droid product purchase cant even charge begin go back bestbuy buy another ipad mini cost much much reliable,1.0
3427,Whats the point of this without the cable to charge!,whats point without cable charge,1.0
23482,This product not good waste of money I would recommend it,product good waste money would recommend,1.0
26309,"She never has an answer for anything, she has to always be connected to an outlet, too hard to connect to other devices",never answer anything always connect outlet hard connect device,1.0
3114,I wish this came in white to match my Kindle Paperwhite,wish come white match kindle paperwhite,1.0
30917,I can't seem to be able to hook it up with my internet connection. I will be returning it to the store.,cant seem able hook internet connection return store,1.0
2502,It was on a total of an hour and a half when the screen went completely dark. Would not turn on after that. The battery was fine....It just quit working all together.,total hour half screen go completely dark would turn battery fineit quit work together,1.0
29872,This item is the worst ever a d the tech support is even worst. Spent hour troubleshooting and their solution was to return it to Bestbuy a d get anotherone. So i did. And guess what? It didn't work ether. Basically the Netflix app can't be downloaded becuse the Amazon Fire tv won't let you and to make it worst if you're a fan of HBO brace yourself becuase the app isn't even available on their app store. HBO simply doesn't exist. I spent in total 4 days troubleshooting with the Amazon team actually managing the Fire TV remotely from their offices and the answer was that ether the equipment is defective or that they don't have Netflix or HBO available for it. REALLY ITS FREAKING ADVERTISED ON THE BOX. DONT WAIST YOUR MONEY. better get an apple tv or a roku,item bad ever tech support even bad spent hour troubleshoot solution return bestbuy get anotherone guess didnt work ether basically netflix app cant download becuse amazon fire tv wont let make bad youre fan hbo brace becuase app isnt even available app store hbo simply doesnt exist spent total 4 day troubleshoot amazon team actually manage fire tv remotely office answer ether equipment defective dont netflix hbo available really freak advertised box dont waist money well get apple tv roku,1.0
4744,"can not down load any apps from goggle play, didn't know amazon and goggle don't have agreements to sharge",load apps goggle play didnt know amazon goggle dont agreement sharge,1.0
12742,I bought the Fire for my 8 year old for school after a suggestion from the sales rep in store. Went to set it up and it required a credit card number be entered. Couldn't even download free kids apps. Why would I want my child able to accidently buy something? I refused and thus not able to download anything. We will be returning it. Product appears best for an adult who likes to read books on tablet.,bought fire 8 year old school suggestion sale rep store go set require credit card number enter couldnt even download free kid apps would want child able accidently buy something refuse thus able download anything return product appear best adult like read book tablet,1.0
4837,"I purchased this for my son thinking it would be a good beginner tablet. I was so wrong. I couldn't even get it set up for him to use it. Before you comment that it may be the user, I have set up every electronic device I have purchased for myself or my children (compters, cell phones, lap tops, game systems) This tablet would not connect to wifi. I even took it across town thinking it could try that but still nothing. Maybe it was defaulty equipment. I sat right beside him and had perfect wifi. My other son sat right beside him had perfect Wifi.",purchase son think would good beginner tablet wrong couldnt even get set use comment may user set every electronic device purchase child compters cell phone lap top game system tablet would connect wifi even take across town think could try still nothing maybe defaulty equipment sat right beside perfect wifi son sat right beside perfect wifi,1.0
17729,"I am really disappointed in this Kindle....I have had many kindles, but I wanted somwthing I thoughtnwould be simple. This kindle doesn't show all my books that are in my cloud..it doesn't matter that they aren't in my device but they should still show up in my cloud...I have to go to my amazon account and transfer the book I want to my device.",really disappointed kindlei many kindles want somwthing thoughtnwould simple kindle doesnt show book cloudit doesnt matter arent device still show cloudi go amazon account transfer book want device,1.0
34652,"So I was already not too pleased with Amazon's choice to only include an essentially useless charger when purchasing a kindle hd, and caved to ordering the fast charger so it would not take hours of non-use to recharge. For 20 you don't even get a full charger, just an adapter to put on to the cord they already gave you. Amazon please just charge the real price for the device instead of settling to slowly rip people off with essential accessories, this sort of thing cheapens your image and erodes loyalty.",already pleased amazon choice include essentially useless charger purchasing kindle hd cave order fast charger would take hour nonuse recharge 20 dont even get full charger adapter put cord already give amazon please charge real price device instead settle slowly rip people essential accessory sort thing cheapens image erodes loyalty,1.0
9272,"I was expecting a tablet good enough for the kids to play and download games, and I was told at BB that this product would work for these basic needs. It seems like everything I download needs to be through my Amazon account, very few items are for free, and everything takes forever to download and/or open. Wish I could return it!",expect tablet good enough kid play download game told bb product would work basic need seem like everything download need amazon account item free everything take forever download andor open wish could return,1.0
29863,"Everything I had read was a bit confusing on how the Echo can control it.. but low and behold it has the Alexa service built into it. The Echo CANNOT control the Amazon Fire TV which was the sole reason I bought it. Well.. also in hopes that HBO Now would have Surround Sound on it, but of course it didn't. So they're both at fault here and the reason why I returned it immediately. Since neither of the above worked, this made the device completely redundant with my Chromecast.",everything read bit confuse echo control low behold alexa service built echo can not control amazon fire tv sole reason bought well also hope hbo would surround sound course didnt theyre fault reason return immediately since neither work make device completely redundant chromecast,1.0
241,Didn't want to go to the sites amazon wanted me to.,didnt want go site amazon want,1.0
3338,This is honestly a little expensive. And I can find other ways to charge my devices.,honestly little expensive find way charge device,1.0
17443,"I didon't care for this tablet, downloading apps outside of Amazon was really confusing.",didont care tablet download apps outside amazon really confuse,1.0
17005,"did not power up...at all. I am so happy that my grand-niece wasn't here and doesn't know about this yet, she would have been crying.",power upat happy grandniece wasnt doesnt know yet would cry,1.0
17167,"I purchase this tablet for my son and it was very disappointing on the 3 exchanges I had to do. First the charger was not working, second the free time was not connecting and third exchange it was freezing. So many good reviews for this tablet but it did not work for me.",purchase tablet son disappoint 3 exchange first charger work second free time connect third exchange freeze many good review tablet work,1.0
27448,I really wanted this as a Christmas present however it's nothing like the ads. Alexa works sometimes and then not. I can't get her to play music or listen to the radio through her. Very disappointed. Plan on taking it back.,really want christmas present however nothing like ad alexa work sometimes cant get play music listen radio disappointed plan take back,1.0
11649,Tablet was ok when it worked. Seemed to always have to reset our Wi-Fi at home for this one item. Everything else worked fine.,tablet ok work seem always reset wifi home one item everything else work fine,1.0
9331,A lot of apps are incomplete. Doesn't run apps that great and has a lot of apps that are generic.,lot apps incomplete doesnt run apps great lot apps generic,1.0
32368,It locked up on installing kodi and it wouldn't recover. The device buffers during first setup of any movie. Voice remote is not the best.,lock instal kodi wouldnt recover device buffer first setup movie voice remote best,1.0
23514,Alexa answers maybe 1 out of 10 questions we ask her - she uses Bing.com and it is really bad. Her standard answer is - I don't know the answer to this question. We ask her easy questions about stats or people. We also have a Google home and it answers almost every question right.,alexa answer maybe 1 10 question ask us bingcom really bad standard answer dont know answer question ask easy question stats people also google home answer almost every question right,1.0
12250,Bought for my grandson he doesn't like it it's to slow..,bought grandson doesnt like slow,1.0
4683,"I got this tablet for Christmas and only used it for one day. The next day I could not use it, it keep glitching. When I got it, the box was opened and it had an inspect sticker on the box, I guess that is what Best Buy does. I think someone switched it out. I took it back to Best Buy to see if someone could fix it and they said it would be $200 to fix or call Amazon. Why would I pay $200 to fix a tablet that was $40. Amazon is replacing my defected one for free after many attempts to fix it.",get tablet christmas use one day next day could use keep glitching get box open inspect sticker box guess best buy think someone switch take back best buy see someone could fix say would 200 fix call amazon would pay 200 fix tablet 40 amazon replace defect one free many attempt fix,1.0
16141,This is just a regular fire tablet that has protective case.,regular fire tablet protective case,1.0
34386,Bought the fire TV excited about the 4K support. The first night it refused to load video content. I could only stream music. Now it refuses to load at all. It has completely stopped responding to the remote. Remote feels cheap.,bought fire tv excite 4k support first night refuse load video content could stream music refuse load completely stop respond remote remote feel cheap,1.0
5277,"This tablet disappointed me from the beginning. I loved my previous Fire tablet. However, this new one disappointed me from get go. I do not want it to tell me what I like or want! I do not like ads that pop up, I do not want suggestions for me on books, movies or anything else. I know what I like! I definitely do not want it talking to me! In this day and age, with identity theft prevalent, I would like to be able to have apps without having to turn on features like location, etc.. All in all, I am ready to bust it up and throw it away!",tablet disappointed begin love previous fire tablet however new one disappointed get go want tell like want like ad pop want suggestion book movie anything else know like definitely want talk day age identity theft prevalent would like able apps without turn feature like location etc ready bust throw away,1.0
15722,I I thought the buy For my child bc the kids mode but it was very poor,thought buy child bc kid mode poor,1.0
9034,I bought this tablet on black Friday and went home to test it out and it was very slow and not worth the money,bought tablet black friday go home test slow worth money,1.0
28814,Expected it to be a bigger version of the HDX but it was not. The email was bad and so was the calendar.,expect big version hdx email bad calendar,1.0
18942,"I purchased this ereader because it stated you could get library booksvia USB cord (and Wifi if you are near one). I do not have Wifi andthe USB would not transfer. Tried everything, neighbor tried, readinstructions, viewed YouTube. But it wouldn't work. Took it back but it was beyond 15 days and they would only give me credit. I then upgraded to Wifi 3g and that better work for the extra money. Very disappointed as I felt I had no other choice.",purchase ereader state could get library booksvia usb cord wifi near one wifi andthe usb would transfer try everything neighbor try readinstructions view youtube wouldnt work take back beyond 15 day would give credit upgraded wifi 3g well work extra money disappointed felt choice,1.0
21795,We got this for our son. He is always wanting to play on Mom's tablet so we thought this would be a good choice. His aunt does a lot of tech shopping and bought this same one for his sister so we got the same one. Within a month the charging cord on both units quit working and shortly after that the ports became squirly so you have to hold them just right or they don't charge. Save your money and get a more expensive but better quality product.,get son always want play mom tablet thought would good choice aunt lot tech shopping bought one sister get one within month charge cord unit quit work shortly port become squirly hold right dont charge save money get expensive well quality product,1.0
8601,"I purchased this tablet on a discounted price as an alternative for RC tablet. The operating system is not good, very slow response, apps takes a lot of time to open. Many of the apps like youtube is not made for fire OS, so my little one has a difficult time handling it. After 2 months, I got him RC tablet.",purchase tablet discount price alternative rc tablet operating system good slow response apps take lot time open many apps like youtube make fire o little one difficult time handle 2 month get rc tablet,1.0
10360,I bought this tablet because of the price and the specs seemed fine but it is slow it freezes and crashes I dont think it was a good buy,bought tablet price spec seem fine slow freeze crash dont think good buy,1.0
5044,"I totally love the Kindle Fire tablets purchased for my grandkids. My sister purchased one in our hometown for my mother. She is equally happy. My granddaughter and grandson spend their wind down time in the evening on the tablets playing their favorite games. In addition, they want a dog and conduct research for the type of dog that the would like. Overall, the tablets are easy to use and provides technology for them when they visit every other weekend. I am pleased.",totally love kindle fire tablet purchase grandkids sister purchase one hometown mother equally happy granddaughter grandson spend wind time even tablet play favorite game addition want dog conduct research type dog would like overall tablet easy use provide technology visit every weekend pleased,1.0
30632,"Hated it ! You have to purchase everything from Amazon ! Took it back within a couple days! Got the roku ,,,,, way better !",hat purchase everything amazon take back within couple day get roku way well,1.0
9485,Except unlike the Millennium Falcon this doesn't have it where it counts. Software is a mess. I didn't expect much from a $50 tablet but man was it painful to use.,except unlike millennium falcon doesnt count software mess didnt expect much 50 tablet man painful use,1.0
21502,"I have never had so many issues with a kindle and I have purchased alot. It's slow. It shuts off whenever it wants, the sd card dosent read half the time. And when it does it seems to be downloading it. And it deleted apps off my other kids kindle or adds when I do ... very very stupid . It has cracked . And I have never dropped it . It isn't made well. I am going to return it and I will probably never buy another kindle . HORRIBLE",never many issue kindle purchase alot slow shuts whenever want sd card dosent read half time seem download delete apps kid kindle add stupid crack never drop isnt make well go return probably never buy another kindle horrible,1.0
8175,This is my 3rd kindle and my last-i'm moving on to something better!For me -following all packaging insert guidelines-they only lasted a year at the most.,3rd kindle lastim move something betterfor follow packaging insert guidelinesthey last year,1.0
12616,"I picked up this tablet thinking it would be a great buy. I have a few family members that own the previous model of the kindle fire and highly approve of them. The new product I got was very disappointing, The display had a dead pixel on it when I turned it on. The product is very slow and the cameras leave a lot to be desired. I took it back and exchanged for an IPad Mini 4 and am very happy with it.",picked tablet think would great buy family member previous model kindle fire highly approve new product get disappoint display dead pixel turn product slow camera leave lot desire take back exchange ipad mini 4 happy,1.0
18000,Our daughter loves the size and portability of the product. Her iPad died and she uses her Mac book for school so this was a great choice for her to read books on.,daughter love size portability product ipad die us mac book school great choice read book,1.0
33653,I had no cable but had internet so I thought this Amazon item would be good. Basically you have to pay for each subscription to use this making it super costly. I retuned this and just use Netflix with a wifi enabled tv.,cable internet thought amazon item would good basically pay subscription use make super costly retuned use netflix wifi enable tv,1.0
6706,"Worked fine for a month, then refused to take a charge. Returned to best buy, and advised that amazon like to handle their own warranty issues. Stuck with a store credit card. I suppose it will get used, but not impressed with the product at all",work fine month refuse take charge return best buy advise amazon like handle warranty issue stuck store credit card suppose get use impressed product,1.0
9435,This makes my phone way to big can't fit in pockets,make phone way big cant fit pocket,1.0
21566,"I bought this thinking since we'd bought several other refurbished things that worked, that it would be okay. The box never booted properly so the only thing we could stare at was the Amazon logo and the words Unknown Boot in the corner. Customer Service tried to help with the box but we couldn't get it to trouble shoot. Sending this box back.",bought think since wed bought several refurbish thing work would okay box never boot properly thing could stare amazon logo word unknown boot corner customer service try help box couldnt get trouble shoot send box back,1.0
14902,I bought a Kindle Fire 16GB for my 6 year old son in June. After 4 months the charging port came loose and the device will not charge. Best Buy is aware of the issue and will do nothing about it. Amazon will not warranty their product for more than 90 days and they said the charging ports often break if children are using them! They have no options to fix the device and only offer a small discount if I buy a new one. Amazon does not stand behind this product. They are aware of the defect and continue to sell these.,bought kindle fire 16gb 6 year old son june 4 month charge port come loose device charge best buy aware issue nothing amazon warranty product 90 day say charge port often break child use option fix device offer small discount buy new one amazon stand behind product aware defect continue sell,1.0
2780,Prior to using the device I decided to recharge it to 100% and was shocked to find out that it takes 6 hours. Unless you have a lot of time don't buy this device.,prior use device decide recharge 100 shock find take 6 hour unless lot time dont buy device,1.0
12621,Luckily best buy exchanged the kindle fire for a Lenovo tablet with courtesy and ease. Thank you best buy! It was a black Friday purchase that I did nothing with until late January/ early February. Great way to do business and therefore keep it.,luckily best buy exchange kindle fire lenovo tablet courtesy ease thank best buy black friday purchase nothing late january early february great way business therefore keep,1.0
3947,I don't like this tablet as Android is not working well,dont like tablet android work well,1.0
1372,I brought this tablet during the Black Friday sale fast forward to Christmas when my 6 year opens it he was happy I set it up for him two days later it crashed never came back on. Blank screen. He was disappointed and so was I .,brought tablet black friday sale fast forward christmas 6 year open happy set two day later crashed never come back blank screen disappointed,1.0
22808,"Unless you have fiber optic internet, don't buy this. If you have ATT Uverse it will mess up the TV, lower the speed of your internet, and play havoc with the phone.It has not worked yet since getting it, since I only have 25mgb of internet, and it really does not work at that speed at all.",unless fiber optic internet dont buy att uverse mess tv low speed internet play havoc phoneit work yet since get since 25mgb internet really work speed,1.0
7046,"Ouch. I bought this Fire tablet, and used it for about four hours, and left it on a charger. A couple of hours later, I picked up the tablet, and the screen was showing a weird 'ghosting' effect, and then the screen went completely black.I twisted the chassis and screen a bit and managed to get things working again, just long enough to do a factory reset and return the tablet.I'm sure I had a defective/damaged tablet, but I was underwhelmed with the quality, and it would be nice if Amazon brought back the higher quality HDX tablets, for people who don't mind paying more for quality tablets.",ouch bought fire tablet use four hour left charger couple hour later picked tablet screen show weird ghost effect screen go completely blacki twist chassis screen bit manage get thing work long enough factory reset return tabletim sure defectivedamaged tablet underwhelmed quality would nice amazon brought back high quality hdx tablet people dont mind pay quality tablet,1.0
28660,"Just got this as a Christmas gift and it doesn't stand.. Nothing to secure it to make it stand.. You can get it to stand maybe to watch a video, but don't touch it. It will fall down easily. Certainly don't stand it and actually use your Fire HD6 with this cover.. You can't.. Falls right over. I feel really badly for the special person that bought me this. Waste of money. I had already bought my own cover, for a lot cheaper, that has more shock protection and that one won't stand on end, but at sits securely at a tilt which makes it more useful for me. The cheaper one I bought on Amazon also has a magnetic closer to the cover stays closed. This one does not. Not sure how to tell the person who bought me this that I don't like this one at all. I'll feel bad telling them, and they'll feel bad hearing it. Bad all around.",get christmas gift doesnt stand nothing secure make stand get stand maybe watch video dont touch fall easily certainly dont stand actually use fire hd6 cover cant fall right feel really badly special person bought waste money already bought cover lot cheaper shock protection one wont stand end sits securely tilt make useful cheaper one bought amazon also magnetic closer cover stay close one sure tell person bought dont like one ill feel bad tell theyll feel bad hearing bad around,1.0
25782,"Will not stay connected to WiFi. When it is connected, device has to be within 6-8 ft. of router. Need this in the kitchen. Don't want to walk 25+ feet to use it. My other wifi devices work everywhere in the house as well as most of yard and garden. So I don't get it. Sick of looking at it - useless.",stay connect wifi connect device within 68 ft router need kitchen dont want walk 25 foot use wifi device work everywhere house well yard garden dont get sick look useless,1.0
2832,This is not an upgrade by any means! My three year old kindle outperformed Oasis.Battery life better than a week with the lights on lowest setting Magnetic connector is poorly designed and grows weak Two pieces to keep up with; unsnaps constantly Amazon Customer Services promises it will resolved in an update,upgrade mean three year old kindle outperform oasisbattery life well week light low set magnetic connector poorly design grows weak two piece keep unsnaps constantly amazon customer service promise resolve update,1.0
