,text,review_cleaned_lemmatized,rating
26892,Awesome and expandable to so many different uses. Make sure to get the accessories to really take advantage of the unit.,awesome expandable many different us make sure get accessory really take advantage unit,5.0
28613,Replaces the original with no problems whatsoever.,replaces original problem whatsoever,5.0
16685,Has everything you will ever need inside. For children and adultsA+++,everything ever need inside child adultsa,5.0
33788,"Love these, great cable cutter. A little glitchy on the remote but really good product",love great cable cutter little glitchy remote really good product,5.0
10502,This is a great product and a really good by for the price. Great buy at best buy.,great product really good price great buy best buy,5.0
9652,This was a birthday gift for my grandson. He loves it.,birthday gift grandson love,5.0
26008,"Really neat little device! We were an Apple only ecosystem family but Alexa is fitting in just fine. We used it for listening to music and getting the weather mostly but have since discovered the skills that can be enable through the Alexa app. We already had a harmony hub and with a little setup after enabling the harmony skill we can now control our home entertainment devices with our voice such as ""Alexa, turn on Apple TV"".",really neat little device apple ecosystem family alexa fitting fine use listen music get weather mostly since discover skill enable alexa app already harmony hub little setup enable harmony skill control home entertainment device voice alexa turn apple tv,5.0
17909,"I had the old Version of the Kindle and loved it. But now that I have the Paperwhite, i realize what a good decision it was to trade up. The contrast is like reading a real book and it doesn't hurt your eyes to read it for a long time.",old version kindle love paperwhite realize good decision trade contrast like reading real book doesnt hurt eye read long time,5.0
33944,"I have always wanted to get the best products for the money for my audio video experience. The Amazon Fire for 4K has not disappointed. It was exceptionally easy to set up and attach to the internet and my TV. The updates for the Fire are seemless and fast. The visual quality is what was expected. If you already own the Fire would I recommend the upgrade? Do not know, but wish there was some sort of buyback program and then the choice would be easier. I do like the gaming ability of the system but have yet to explore those options extensively.",always want get best product money audio video experience amazon fire 4k disappointed exceptionally easy set attach internet tv update fire seemless fast visual quality expect already fire would recommend upgrade know wish sort buyback program choice would easy like game ability system yet explore option extensively,5.0
1732,I already own one but bought another for my sister in law for Christmas.,already one bought another sister law christmas,5.0
16599,My grandson used my old I Phone to play on. Got him this tablet and he loves it! Great deal!,grandson use old phone play get tablet love great deal,5.0
14589,Capable to run games just as spected and very handly,capable run game spected handly,5.0
1861,"Most of the Kindles I have purchased have been gifts, but this one was for me. It is just what I expected from the reviews. Great tablet for the money.",kindles purchase gift one expect review great tablet money,5.0
12804,Enjoyed a lot. Great tablet for the price: well worth the money spent! A bargain!,enjoy lot great tablet price well worth money spent bargain,5.0
16933,"Great for my one year old baby,he loves to play games and watch movies..",great one year old babyhe love play game watch movie,5.0
15339,a gift. He LOVES it. was a reasonable price. thks.,gift love reasonable price thks,5.0
30090,The fire tv box simply does it all. Very fast and fun to use,fire tv box simply fast fun use,5.0
11310,I was searching on Amazon for the Kindle 7 but it was out of stock until AFTER Christmas. Went to Best Buy and found they had more than enough in stock. Got one for my daughter who loves it. Thanks!,search amazon kindle 7 stock christmas go best buy found enough stock get one daughter love thanks,5.0
4640,"great price, great screen and resolution, easy to use and good performance for less than $50.",great price great screen resolution easy use good performance less 50,5.0
1323,"Great for keeping around the house and doing basic Internet functions. For traveling it lets you bring books, movies and/or tv shows via Amazon so being Amazon Prime is a plus.For you business travelers, out of the box it can open, view, & edit MS Office files, .docx, .xlsx, & .pptx.All this for 25% the price of a iPad. Yes, the iPad can do more, but do you need it?",great keep around house basic internet function travel let bring book movie andor tv show via amazon amazon prime plusfor business traveler box open view edit m office file docx xlsx pptxall 25 price ipad yes ipad need,5.0
23409,"My only regret is not purchasing Amazon Echo sooner. She keeps me up to date with weather, significant events for the day, can sing happy birthday and plays my favorite music. No more plugging in cords from phone to speakers and blah blah blah...I couldn't be more satisfied. Thank you Alexa!",regret purchasing amazon echo sooner keep date weather significant event day sing happy birthday play favorite music plug cord phone speaker blah blah blahi couldnt satisfied thank alexa,5.0
20225,"This is so perfect for reading. If you only want it for reading, then I would most definitely get this. I can read for hours on it, in light and in the dark. It's super easy to buy books and download books. Favorite Christmas purchase!",perfect reading want reading would definitely get read hour light dark super easy buy book download book favorite christmas purchase,5.0
885,"Purchased this a couple of weeks ago, no complaints so far. Web pages load pretty quickly on the Silk browser, and the battery life is excellent. After installing Google Play Store (it's really easy!) even more apps are available. Can't beat this for under a hundred dollars!!!",purchase couple week ago complaint far web page load pretty quickly silk browser battery life excellent instal google play store really easy even apps available cant beat hundred dollar,5.0
26821,Fun gadget that has more uses than I realized. A++,fun gadget us realize,5.0
11700,Easy to navigate. There's not anything new we don't like about it.,easy navigate there anything new dont like,5.0
4138,"I bought this for my husband to replace his original Kindle. The lighted background and light weight makes it perfect for reading in bed. The added features of Internet and numerous apps make it perfect for so many uses. It is easy to manage and the grandkids also love using it for the games. It has a great camera, too! Overall very pleased.",bought husband replace original kindle light background light weight make perfect reading bed add feature internet numerous apps make perfect many us easy manage grandkids also love use game great camera overall pleased,5.0
32162,Unbelievable quality for a great price. Easy to set up and awesome customer support.,unbelievable quality great price easy set awesome customer support,5.0
6017,I've had two other tablet before this one and gave both of them away due to shoddy performance. Finally decided to try the Amazon Fire after recommended by a friend and so far I love it!,ive two tablet one give away due shoddy performance finally decide try amazon fire recommend friend far love,5.0
26816,"I use this item everyday. It can be for the time, play music on Spotify, weather, anything. I have the Echo and the Echo dot.",use item everyday time play music spotify weather anything echo echo dot,5.0
26270,One of those things that you never realize you needed until you actually get it. I can't imagine not having this thing now! Definitely recommended,one thing never realize need actually get cant imagine thing definitely recommend,5.0
820,im always using my amazon tablet...perfect for games!!!,im always use amazon tabletperfect game,5.0
471,The Fire HD8 strikes an excellent balance between performance and price. It has many of the features you'd want in a tablet for a fraction of the cost. Works flawlessly for reading and video streaming.,fire hd8 strike excellent balance performance price many feature youd want tablet fraction cost work flawlessly reading video stream,5.0
28315,I really enjoy today's electronic gadgets and this is a really nice addition to my collection.,really enjoy today electronic gadget really nice addition collection,5.0
3958,Son loves this tablet kid friendly tons of games very pleased,son love tablet kid friendly ton game pleased,5.0
20829,This e-reader fits very nicely into my library of other electronic devices. It works great.,ereader fit nicely library electronic device work great,5.0
18684,Bought his for the lady because she kept getting distracted when trying to read things on the iPad. Plus the lighting on the iPad is a bit harsh when reading at night. This was the perfect answer to both of those things.,bought lady kept get distract try read thing ipad plus light ipad bit harsh reading night perfect answer thing,5.0
18612,This was just the right size for travel and there is no glare. I especially like the dictionary feature.,right size travel glare especially like dictionary feature,5.0
24063,So far I really am enjoying this. I can ask it to play any music and so many other things. I'm still learning. Bought it to listen to music in the garage. I'm not disappointed. Have a radio out there but it's hard to get a station in,far really enjoy ask play music many thing im still learn bought listen music garage im disappointed radio hard get station,5.0
31080,l love my fire tv. liked it somuch i purchased a firestick formy other tv. i use them every day!,l love fire tv like somuch purchase firestick formy tv use every day,5.0
21876,"I still haven't used the camera, once I figure it out I will use it. I love the features on it. I use it for facebook mostly & emails. I also play some of the games on facebook.",still havent use camera figure use love feature use facebook mostly email also play game facebook,5.0
22458,"Alexa is fun, a bit biased to amazon product. Example: when I scream at her to play a song she will play it from amazon music and not my Spotify unless I instruct her to. Which isn't terrible, but just a heads up. She is way quicker than your phone for finding answers to things, but the algorithm to get exactly what you're looking for is still being worked on. So don't expect her to always find the right answer. She's still a great product and fun.",alexa fun bit bias amazon product example scream play song play amazon music spotify unless instruct isnt terrible head way quicker phone find answer thing algorithm get exactly youre look still work dont expect always find right answer shes still great product fun,5.0
776,"Does all the basic stuff I need at a great price. I use it for some apps, web browsing and some video. Picked this over the Fire 7"" for the screen size, resolution and CPU/GPU. Battery life is pretty good. Ads aren't too annoying.Far cheaper than competing name-brand budget tablets while doing almost everything needed at this level and probably better supported. FireOS will always be a little behind the current Android version and I'd rather have Google Play than Amazon, but this still allows for side-loading stuff.Recommend if you're ok with living in Amazon's world and/or proficient enough to load other app stores or packages (or know somebody can).",basic stuff need great price use apps web browsing video picked fire 7 screen size resolution cpugpu battery life pretty good ad arent annoyingfar cheaper compete namebrand budget tablet almost everything need level probably well support fireos always little behind current android version id rather google play amazon still allows sideloading stuffrecommend youre ok living amazon world andor proficient enough load app store package know somebody,5.0
28282,"this is great, really easy to use - the playlists are fantastic",great really easy use playlist fantastic,5.0
425,"great size,sound and battery. just buy it already.",great sizesound battery buy already,5.0
34399,I especially like the integration of Netflix and the voice control.,especially like integration netflix voice control,5.0
28627,This unit will charge faster than what came with the Amazon Fire HD-8. It's worth it. I can't stand waiting for charging!,unit charge faster come amazon fire hd8 worth cant stand wait charge,5.0
18767,Super easy to read in any light! So easy to download books!,super easy read light easy download book,5.0
24408,I recently purchased 3 Echoes - for my daughters and myself then I purchased this one for my friend because she loved it so much. It is a handy resource and it's also fun! It's really a cool device.,recently purchase 3 echo daughter purchase one friend love much handy resource also fun really cool device,5.0
6494,Great product for the price. Has everything my child needed. I recommend it for starters,great product price everything child need recommend starter,5.0
22853,"Alexa can answer most questions, play music from your library, and even order items you have run out of. This ""toy"" is a lot of fun! I recommend it - I haven't had it very long but so far so good - thumbs up for Alexa!",alexa answer question play music library even order item run toy lot fun recommend havent long far good thumb alexa,5.0
5410,"I really like it, I can see the letters perfectly and it has a perfect size",really like see letter perfectly perfect size,5.0
5616,"This is a good tablet for someone who wants a starter. Nice screen, easy to use. Great graphics.",good tablet someone want starter nice screen easy use great graphic,5.0
19239,This is my second kindle purchase. I absolutely love them. It's compact and easy to use.,second kindle purchase absolutely love compact easy use,5.0
3075,"Gets use everyday by my girlfriend who i bought it for with no complaints, also love the color. Also may get one for myself.",get use everyday girlfriend bought complaint also love color also may get one,5.0
26490,good sound quality and understand what you are asking without repeating yourself,good sound quality understand ask without repeat,5.0
23675,family member has one and has it connected to all things in the house and i loved it,family member one connect thing house love,5.0
32588,Firestick was laggy so i upgraded to the fire tv. Smooth and better then the firestick. Should have bought the fire stick instead of the firetv.,firestick laggy upgraded fire tv smooth well firestick bought fire stick instead firetv,5.0
22279,Love this speaker it sounds great and love controlling it without having to touch it,love speaker sound great love control without touch,5.0
2870,"Even when I’m outside in bright sunlight, the words of the book I’m reading are still crystal clear. That alone makes the Kindle Oasis worth what it cost me.The Kindle Oasis wakes up in just seconds, and any book I choose instantly opens, ready to be read.It is the perfect size and isn’t heavy or bulky. I really do read for hours at a time. Sometimes I pace the floor while I read. Sometimes I’m on my elliptical machine when I read. And sometimes I’m sitting down. No matter what I’m doing, the Kindle Oasis remains comfortable to hold, and it is always easy on my eyes.When I receive a book that is in PDF, most of the time I can enlarge the words. If it won’t allow me to enlarge the words, I can change the orientation of the page and the words are automatically larger. I am able to make notes on the book if needed, and I can highlight words and/or passages.My merlot leather cover is attractive. When I flip it open, it is just like opening the cover of a book.How to Make the Battery LastOn the Kindle Oasis page, it says that its “dual-battery charging system delivers months of battery life.” This was a huge thing for me. Instead of having to charge my tablet almost every day, I would be able to read for months without charging the Kindle!Is this how my Oasis has performed? Well, not so much. There are conditions that have to be met for the charge on your Oasis to last for two months.First, you have to limit your reading to thirty minutes a day. That one is impossible for me. There are days that I am only able to read for thirty minutes, but they don’t occur very often. My Kindle goes everywhere with me, and I use just about every spare moment to read.Second, the wireless needs to be turned off. That one is easy to do but not always easy to remember. The only time the wireless needs to be on is to download one or more books.Third, this is based on your light setting at 10. That is way too low for me. I keep my light setting anywhere from 16 to 18.I don’t limit my reading to thirty minutes a day, and I try to remember to keep my wireless turned off. My light setting is kept anywhere from 16 to 18, and I put my Kindle to sleep the second I’m done reading. So how long does a single charge last me? Ten days is the longest a charge has lasted me so far, but it would have kept a charge for several more days if I had remembered to turn my wireless off. Once I succeed in keeping my wireless off, I will let you know how long the charge lasts.Now, I don’t plug it in to charge as soon as the charge on the cover gets low. I allow my cover charge to go as low as it will possibly go and then the Kindle battery will start to drain since it can no longer charge from the cover. I allow it to drain down to about 50% before I plug the cover and Kindle into my computer to charge.The one thing that surprised me was that everything on the Oasis is in black and white. For some reason, I thought that maybe the book covers would appear in color. But since I bought the Oasis to read books on, color isn’t needed.Special offers do appear on my screen but only when my Kindle is going to sleep or waking up. They aren’t a distraction, and to be honest, they are kind of fun to look at. You can pay a higher price so they won’t appear on your Kindle if you would rather not see them.I asked myself some questions once I had my Kindle and knew just how it worked. If I had known before I bought my Kindle Oasis that the charge wouldn’t last for months, would I still have bought it? Yes, I would have. If I had known that everything would appear in black and white, would I still have bought it? Yes, I would have.",even im outside bright sunlight word book im reading still crystal clear alone make kindle oasis worth cost methe kindle oasis wake second book choose instantly open ready readit perfect size isnt heavy bulky really read hour time sometimes pace floor read sometimes im elliptical machine read sometimes im sit matter im kindle oasis remains comfortable hold always easy eyeswhen receive book pdf time enlarge word wont allow enlarge word change orientation page word automatically large able make note book need highlight word andor passagesmy merlot leather cover attractive flip open like opening cover bookhow make battery laston kindle oasis page say dualbattery charge system delivers month battery life huge thing instead charge tablet almost every day would able read month without charge kindleis oasis perform well much condition met charge oasis last two monthsfirst limit reading thirty minute day one impossible day able read thirty minute dont occur often kindle go everywhere use every spare moment readsecond wireless need turn one easy always easy remember time wireless need download one booksthird base light set 10 way low keep light set anywhere 16 18i dont limit reading thirty minute day try remember keep wireless turn light set kept anywhere 16 18 put kindle sleep second im do reading long single charge last ten day long charge last far would kept charge several day remember turn wireless succeed keep wireless let know long charge lastsnow dont plug charge soon charge cover get low allow cover charge go low possibly go kindle battery start drain since longer charge cover allow drain 50 plug cover kindle computer chargethe one thing surprised everything oasis black white reason thought maybe book cover would appear color since bought oasis read book color isnt neededspecial offer appear screen kindle go sleep wake arent distraction honest kind fun look pay high price wont appear kindle would rather see themi ask question kindle knew work know bought kindle oasis charge wouldnt last month would still bought yes would know everything would appear black white would still bought yes would,5.0
15166,Great product for the price I paid. Highly recommended.,great product price paid highly recommend,5.0
7550,"I bought 3, better than we ever dreamed for money spent",bought 3 well ever dream money spent,5.0
7991,"What a great tablet. I purchased this Amazon fire tablet for my niece for Christmas I love the colors that are available, the price was excellent. Very happy with my purchase definitely would recommend to anyone looking for a low price tablet.",great tablet purchase amazon fire tablet niece christmas love color available price excellent happy purchase definitely would recommend anyone look low price tablet,5.0
22536,"Alexa can do everything from playing music, turning on lights to regulating your thermostat",alexa everything play music turn light regulate thermostat,5.0
19037,"The most benefit of the kindle is it just could read, hence, i often use it and put my phone away. the white one is so beautiful!",benefit kindle could read hence often use put phone away white one beautiful,5.0
15866,My son loves his tablet! It's easy for him to use and he enjoys all the games that come with it. No problem with the storage or speed of apps. I previously bought him the Samsung tablet and when that broke it was difficult to get it fixed. I like that Amazon gives you a two year warranty.,son love tablet easy use enjoys game come problem storage speed apps previously bought samsung tablet broke difficult get fix like amazon give two year warranty,5.0
22142,"I've always been a fan of gadgets,and I had to have it.I had read some of the reviews that were quite favorable, but I had to find out for myself.I absolutely love it. The sound is rich and room filling. In fact, the sound in bigger than its very discreet size.",ive always fan gadgetsand iti read review quite favorable find myselfi absolutely love sound rich room fill fact sound big discreet size,5.0
18406,Great product! Easy on the eyes in the day or night.,great product easy eye day night,5.0
33890,"I love this device. User friendly, excellent performance. Way faster than stick version. And not limited like the Apple. I enjoy it!",love device user friendly excellent performance way faster stick version limited like apple enjoy,5.0
18510,"The Paperwhite is great upgrade from my old reader. Easy to read, easy to carry (important cause I travel a lot). Definitely worth the price.",paperwhite great upgrade old reader easy read easy carry important cause travel lot definitely worth price,5.0
20445,Got for my wife for Christmas. She loves it! Would recommend to others wanting the experience in a smaller device.,get wife christmas love would recommend others want experience small device,5.0
13301,Bought for my son as a bridge between phone and computer. Fits in perfect,bought son bridge phone computer fit perfect,5.0
8030,My kids adore their tablets! Best purchase ever!!!,kid adore tablet best purchase ever,5.0
24161,Easy to setup. Bought Amazon Echo for the living room and Amazon Dot for the bedroom. Fantastic AI.,easy setup bought amazon echo living room amazon dot bedroom fantastic ai,5.0
24718,I bought the echo after reading about it and we love it. It was very easy to set up with our wireless network and everyone one in the house uses it to learn all types of information along with listening to songs.,bought echo reading love easy set wireless network everyone one house us learn type information along listen song,5.0
15640,Love my first tablet and I have recommend this to my Mom. She bought one too!! Not as heavy as some other models. Perfect for playing games on and watching movies. In love...,love first tablet recommend mom bought one heavy model perfect play game watch movie love,5.0
29586,"I recently got rid of cable and WiFi at home as it all just became way too expensive. I wanted something that would run off of my hotspot on my phone as I have an unlimited plan. It connects to it as soon as I have it on, there is no lagging, doesn't take long to load any of my streaming services either. It is very easy to navigate through the menu and do everything. Steup was a breeze, I love the voice feature (definitely comes in handy).",recently get rid cable wifi home become way expensive want something would run hotspot phone unlimited plan connects soon lag doesnt take long load stream service either easy navigate menu everything steup breeze love voice feature definitely come handy,5.0
22862,"Love it and it's accessible for the blind. Music, weather, jokes, sound effects, reads me books, she does it all.",love accessible blind music weather joke sound effect read book,5.0
1548,Reasonably priced and great for the grandkids. We purchased cheaper tablets for them last year and none of them lasted! So far these are looking 100% better.,reasonably price great grandkids purchase cheaper tablet last year none last far look 100 well,5.0
16870,"My kids love this tablet. There are over hundreds of games, books, and shows to pick from",kid love tablet hundred game book show pick,5.0
12581,Its a quick fast little tablet. Can do a lot of stuff a normal tablet does.,quick fast little tablet lot stuff normal tablet,5.0
